Review,Stars
"I am Kotak Bank account holder since 2014. My salary account is in Kotak so I am using this app for last few months and most of the features of this app is very good. Money transfer, ticket booking, recharge and many more things available with this apps. In my opinion money transfer with this ap...Read More",4
"Kotak - 811 and mobile banking it looks good that we get a saving account without visiting the branch that too within 5 minutes. But actually it is not a proper saving account it is just like other existing mobile wallets like icici pocket, zeta powered by RBL bank etc. where you are required to...Read More",2
"It gives lot of offers on online shopping, flight booking

and also gives many more other experience by simple 811. It minimize wasting of time to open account in bank and provide account that give all the facility that original account holder with passbook get.it also minimize effort to handl...Read More",3
"Kotak- 811 mobile banking app is amazing mobile banking app because that provides all services in one app. When I install this app, Then I have no kotak bank a/c but I open my saving a/c in 2-5 minutes by this app through Aaadhar ekyc.

This mobile app provides all banking and useful services....Read More",4
I have a very good experience with mobile banking that too with Kotak- 811. I don't have bank account in Kotak -811 bank but I use my brother account which is easily in his mobile to use internet banking services very easily. It is India's first downloadable account service. You can even open yo...Read More,3
"Actually I downloaded but I cannot open account not only 5 mins in a hour also. After trying and tired I got custmer centre call to my number. After a long time he decided that we cannot help you sir.

We understand that village people who are far atleast 80km from branches of kotak we cannot ...Read More",3
